code_name,ticker,created_at,text
TCL中环,sz.002129,2022-06-15,"大宗交易成交：中环股份今天出现了一笔大宗交易，成交量为30.87万股，成交金额为1383.90万元，买方营业部为华泰证券股份有限公司成都蜀金路证券营业部，卖方营业部为机构专用。虽然大宗交易成交金额相对较小，但可能会引起一些市场关注和猜测，对股价产生一定影响。
"
TCL中环,sz.002129,2022-06-15,"公司投资成立新公司：中环股份、乐山电力等投资成立了一家注册资本为1.2亿元的新公司——楚雄市晟天新能源有限公司。该公司的经营范围包括发电业务、输电业务、供（配）电业务等。这一消息可能会引起市场对于中环股份在新能源领域的布局和发展前景的关注，从而对股价产生积极影响。
"
TCL中环,sz.002129,2022-06-15,股价波动和资金流向：中环股份今天收盘价为44.83元，下跌1.49%，日换手率为1.37%，成交额为20.03亿元，全天主力资金净流出1.22亿元。这些数据表明今天中环股份股价有所波动，资金流向也出现了一定的变化。对于投资者来说，这些数据可能会影响他们对于中环股份的投资决策，从而对股价产生影响。
